{
  "contract_family": "execution-request",
  "contract_version": "v0.2",
  "request_ref": "request-placeholder-002",
  "outcome": "denied",
  "verification": {
    "scheme": "sha-256",
    "canonicalization": "rfc8785",
    "value": "4561583bd9b621c5436ace137e52380cb2c7563cd6e31b82a31e943b83e87db7"
  },
  "received_at": "2026-08-14T09:05:00Z",
  "request_verification": {
    "scheme": "sha-256",
    "canonicalization": "rfc8785",
    "value": "085d2634b36a07e9464e80fe3720f2351eaec24e284697e98fa71ae45ca4a3bf"
  }
}
